{
  "schemaVersion": "ba.canonical.v1",
  "project": {
    "id": "example-project",
    "name": "Cổng tiếp nhận và xử lý bảo hành",
    "title": "Cổng tiếp nhận và xử lý bảo hành",
    "version": 3,
    "status": "GENERATED"
  },
  "sources": [
    {
      "id": "SRC-001",
      "type": "brief-with-amendments",
      "sha256": "9bf336fc0e3d0ed70306d4cfe0bda31d4968c57a21cbb1e09427ba4a070e2830",
      "note": "Evidence is a quote match, not stakeholder approval."
    }
  ],
  "business": {
    "summary": "Xây dựng cổng đăng ký, xử lý và thống kê yêu cầu bảo hành máy lọc nước.",
    "problem": "Chưa được nêu rõ trong brief — cần xác nhận pain point và KPI.",
    "businessGoals": [
      {
        "id": "BG-001",
        "statement": "Tiếp nhận yêu cầu bảo hành"
      },
      {
        "id": "BG-002",
        "statement": "Quản lý quá trình xử lý bảo hành"
      },
      {
        "id": "BG-003",
        "statement": "Theo dõi số phiếu theo trạng thái"
      }
    ],
    "stakeholders": [
      {
        "role": "Khách hàng",
        "need": "Đăng ký bảo hành"
      },
      {
        "role": "Nhân viên trạm",
        "need": "Xử lý yêu cầu"
      },
      {
        "role": "Quản trị viên",
        "need": "Xem thống kê"
      }
    ],
    "scopeIn": [
      "Đăng ký bảo hành",
      "Theo dõi và cập nhật trạng thái yêu cầu",
      "Báo cáo số phiếu theo trạng thái",
      "Phân quyền theo vai trò"
    ],
    "scopeOut": []
  },
  "requirements": {
    "businessRules": [
      {
        "id": "BR-001",
        "rule": "Phân quyền theo vai trò khách hàng, nhân viên trạm và quản trị viên.",
        "sourceEvidence": "Hệ thống phải phân quyền theo vai trò khách hàng, nhân viên trạm và quản trị viên.",
        "certainty": "confirmed"
      }
    ],
    "functional": [
      {
        "id": "FR-001",
        "name": "Đăng ký bảo hành",
        "description": "Khách hàng nhập số seri và số điện thoại để đăng ký bảo hành.",
        "actor": "Khách hàng",
        "priority": "Must",
        "sourceEvidence": "Khách hàng có thể đăng ký bảo hành bằng số seri và số điện thoại.",
        "certainty": "confirmed",
        "relatedBusinessGoal": "Tiếp nhận yêu cầu bảo hành",
        "preconditions": [],
        "mainFlow": [
          "Mở form đăng ký",
          "Nhập số seri và số điện thoại",
          "Gửi yêu cầu (cần xác nhận quy tắc kiểm tra và phản hồi)"
        ],
        "alternateFlows": [],
        "acceptanceCriteria": [
          "Cho phép nhập số seri và số điện thoại",
          "Cần xác nhận kết quả xử lý khi gửi form"
        ],
        "type": "functional",
        "evidenceStatus": "evidence-found-not-approved",
        "sourceId": "SRC-001"
      },
      {
        "id": "FR-002",
        "name": "Xử lý yêu cầu",
        "description": "Nhân viên trạm xem danh sách và cập nhật trạng thái.",
        "actor": "Nhân viên trạm",
        "priority": "Must",
        "sourceEvidence": "Nhân viên trạm bảo hành xem danh sách yêu cầu, cập nhật trạng thái 'Tiếp nhận', 'Đang xử lý', 'Hoàn thành'.",
        "certainty": "confirmed",
        "relatedBusinessGoal": "Quản lý quá trình xử lý bảo hành",
        "preconditions": [],
        "mainFlow": [
          "Mở danh sách yêu cầu",
          "Chọn một yêu cầu",
          "Cập nhật trạng thái"
        ],
        "alternateFlows": [],
        "acceptanceCriteria": [
          "Danh sách hiển thị yêu cầu",
          "Hỗ trợ ba trạng thái đã nêu"
        ],
        "type": "functional",
        "evidenceStatus": "evidence-found-not-approved",
        "sourceId": "SRC-001"
      },
      {
        "id": "FR-003",
        "name": "Thống kê trạng thái",
        "description": "Quản trị viên xem báo cáo số phiếu theo trạng thái.",
        "actor": "Quản trị viên",
        "priority": "Must",
        "sourceEvidence": "Quản trị viên xem báo cáo số phiếu theo trạng thái.",
        "certainty": "confirmed",
        "relatedBusinessGoal": "Theo dõi số phiếu theo trạng thái",
        "preconditions": [],
        "mainFlow": [
          "Mở trang báo cáo",
          "Xem số phiếu theo từng trạng thái"
        ],
        "alternateFlows": [],
        "acceptanceCriteria": [
          "Báo cáo nhóm phiếu theo trạng thái"
        ],
        "type": "functional",
        "evidenceStatus": "evidence-found-not-approved",
        "sourceId": "SRC-001"
      }
    ],
    "nonFunctional": []
  },
  "elicitation": {
    "questions": [
      {
        "id": "Q-001",
        "question": "Xác thực người dùng và kiểm tra phân quyền bằng cơ chế nào?",
        "impact": "Ảnh hưởng bảo mật và luồng đăng nhập",
        "priority": "High"
      },
      {
        "id": "Q-002",
        "question": "Số seri trùng lặp, không hợp lệ hoặc hết hạn bảo hành thì xử lý thế nào?",
        "impact": "Ảnh hưởng business rules và validation",
        "priority": "High"
      },
      {
        "id": "Q-003",
        "question": "Các trạng thái có được quay lui và ai được chuyển trạng thái?",
        "impact": "Ảnh hưởng transition/permission",
        "priority": "High"
      },
      {
        "id": "Q-004",
        "question": "Báo cáo cần bộ lọc thời gian, trạm và xuất file không?",
        "impact": "Ảnh hưởng phạm vi báo cáo",
        "priority": "Medium"
      },
      {
        "question": "Vấn đề kinh doanh hiện tại và ảnh hưởng cụ thể là gì?",
        "impact": "Chưa thể đánh giá sự phù hợp của mục tiêu và giải pháp.",
        "priority": "Medium",
        "origin": "GAP-001",
        "relatedRequirementId": "",
        "id": "Q-005"
      }
    ],
    "assumptions": [
      "Luồng gửi biểu mẫu, kiểm tra dữ liệu và thông báo kết quả chưa được khách hàng mô tả."
    ],
    "risks": [
      "Chưa có quy tắc trạng thái, kiểm tra số seri và cơ chế xác thực."
    ],
    "amendments": []
  },
  "quality": {
    "policyVersion": "ba-quality-v1",
    "status": "NEEDS_CLARIFICATION",
    "counts": {
      "high": 0,
      "medium": 1
    },
    "findings": [
      {
        "id": "GAP-001",
        "code": "NO_BUSINESS_PROBLEM",
        "priority": "Medium",
        "question": "Vấn đề kinh doanh hiện tại và ảnh hưởng cụ thể là gì?",
        "impact": "Chưa thể đánh giá sự phù hợp của mục tiêu và giải pháp.",
        "requirementId": "",
        "status": "open",
        "origin": "deterministic-check"
      }
    ],
    "baselineEligible": false
  },
  "review": {
    "baReviewed": true,
    "reviewedAt": "2026-10-13T04:00:00.000Z",
    "notes": "Ví dụ demo: BA đã kiểm tra cấu trúc; chưa có khách hàng ký duyệt.",
    "customerApproved": false,
    "baselineStatus": "NOT_BASELINED"
  },
  "prototype": {
    "screens": [
      {
        "id": "SCR-001",
        "title": "Đăng ký bảo hành",
        "description": "Bản phác thảo — quy tắc kiểm tra dữ liệu chờ xác nhận.",
        "requirementIds": [
          "FR-001"
        ],
        "components": [
          {
            "type": "heading",
            "label": "Đăng ký bảo hành",
            "placeholder": "",
            "value": "",
            "options": [],
            "actionTarget": ""
          },
          {
            "type": "input",
            "label": "Số seri",
            "placeholder": "Nhập số seri",
            "value": "",
            "options": [],
            "actionTarget": ""
          },
          {
            "type": "input",
            "label": "Số điện thoại",
            "placeholder": "Nhập số điện thoại",
            "value": "",
            "options": [],
            "actionTarget": ""
          },
          {
            "type": "button",
            "label": "Gửi yêu cầu (minh họa)",
            "placeholder": "",
            "value": "",
            "options": [],
            "actionTarget": ""
          },
          {
            "type": "button",
            "label": "Đến danh sách yêu cầu",
            "placeholder": "",
            "value": "",
            "options": [],
            "actionTarget": "SCR-002"
          }
        ]
      },
      {
        "id": "SCR-002",
        "title": "Danh sách bảo hành",
        "description": "Minh họa giao diện nhân viên trạm — chưa có dữ liệu thật.",
        "requirementIds": [
          "FR-002"
        ],
        "components": [
          {
            "type": "heading",
            "label": "Yêu cầu bảo hành",
            "placeholder": "",
            "value": "",
            "options": [],
            "actionTarget": ""
          },
          {
            "type": "card",
            "label": "Phiếu demo #001 — Tiếp nhận",
            "placeholder": "",
            "value": "",
            "options": [],
            "actionTarget": ""
          },
          {
            "type": "select",
            "label": "Trạng thái (minh họa)",
            "placeholder": "",
            "value": "",
            "options": [
              "Tiếp nhận",
              "Đang xử lý",
              "Hoàn thành"
            ],
            "actionTarget": ""
          },
          {
            "type": "button",
            "label": "Đến báo cáo",
            "placeholder": "",
            "value": "",
            "options": [],
            "actionTarget": "SCR-003"
          },
          {
            "type": "button",
            "label": "Về đăng ký",
            "placeholder": "",
            "value": "",
            "options": [],
            "actionTarget": "SCR-001"
          }
        ]
      },
      {
        "id": "SCR-003",
        "title": "Báo cáo",
        "description": "Chỉ hiển thị dữ liệu mẫu, chưa kết nối hệ thống.",
        "requirementIds": [
          "FR-003"
        ],
        "components": [
          {
            "type": "heading",
            "label": "Báo cáo số phiếu theo trạng thái",
            "placeholder": "",
            "value": "",
            "options": [],
            "actionTarget": ""
          },
          {
            "type": "badge",
            "label": "Tiếp nhận: 3 (demo)",
            "placeholder": "",
            "value": "",